Job Title,Company Name,Location,Working Days,Job Type,Key Indicators,Job Description,Job Conditions
کارشناس مدیریت پروژه هوش مصنوعی و علم داده,موسسه توسعه خدمات فناوری تا بازار ایرانیان,"{'City': 'تهران', 'Neighborhood': '، ستارخان'}",شنبه تا چهارشنبه 8:00 تا 16:30,تمام وقت,[],"['هدف اصلی شغل:', 'پایش، شبکه سازی، رسوخ و به کارگیری و بهینه سازی فناوری های حوزه هوش مصنوعی و علم داده در فناوری های فعلی و آینده ی شرکت های نانویی و زیست بوم نانوی کشور', 'وظایف و مسئولیت های اصلی:', 'نتایج نهایی شغل:', 'شایستگی های کلیدی:', 'صلاحیت/مهارت های حرفه ای:', 'مهارت های عمومی:', 'زبان انگلیسی: (Upper Intermediate)- درک متون مرتبط', 'مهارت های کامپیوتری از جمله آشنایی با آفیس', 'آشنا به نگارش مکاتبات اداری', 'شنایی با نرم افزارهای گزارش نویسی و ارائه گزارش', 'شرایط لازم جهت احراز شغل:', 'تحصیلات: کارشناس ارشد رشته های مهندسی صنایع، مهندسی مواد، مهندسی شیمی، بایوانفورماتیک و بیوتکنولوژی', 'جنسیت: تفاوتی ندارد', 'معرفی شرکت:', 'هرنج پلتفرمی نوآورانه برای شناسایی، توانمندسازی و استخدام نیروی انسانی متخصص است. وظایف شغلی در سازمان های پیشرو نیازمند نیروی انسانی چند مهارتی است و احراز شایستگی های شغلی از طریق روش های مرسوم استخدام دشوار است. پلتفرم هرنج با بهره گیری از روش های نوین مورد استفاده در سازمان های خلاق دنیا طراحی شده است. متقاضیان 2 تا 3 ماه فرآیند یادگرفتن از طریق انجام دادن را سپری کرده و در قالب پروژه فردی و چالش کار تیمی ارزیابی می شوند.']","[('سن', '22 - 32 سال'), ('جنسیت', 'تفاوتی ندارد'), ('تحصیلات', 'کارشناسی ارشد|مهندسی صنایعکارشناسی ارشد|مهندسی مواد و متالورژیکارشناسی ارشد|مهندسی شیمی / پلیمرکارشناسی ارشد|بیوتکنولوژی'), ('زبان', 'انگلیسی|بالاتر از متوسط ۷۰٪')]"
AI Software Engineer,Crouse PJS,"{'City': 'Tehran', 'Neighborhood': ', Jadeh Makhsoos'}",Saturday to Wednesday 7:00 - 16:00 (Floating Time: 2 Hours),Full Time,"['2 years experience in similar position', 'Bachelor Electrical Engineering or Computer and IT']","['Crouse is looking for AI/ML engineers for research and developing approaches to enable the use of AI/ML for a wide range of applications in the automotive industry. In this role, the engineer will contribute across the entire AI/ML lifecycle in a highly collaborative environment, and will develop AI/ML methodologies to address a variety of sensing needs in vehicles, deploy models on various platforms, and actively participate in validation and testing.', 'Responsibilities', 'Requirements', 'Preferred requirements:']","[('Age', '22 - 45 Years Old'), ('Gender', 'Men / Women'), ('Military service', 'Military service must be done'), ('Education', 'Bachelor|Electrical EngineeringBachelor|Computer and IT'), ('Language', 'English|Intermediate - 50%'), ('Software', 'C++|IntermediateGIT|BasicMATLAB|IntermediatePython|Advanced')]"
کارشناس Data و BI,توسعه فناوری ارتباطات پاسارگاد آریان (فناپ تلکام),"{'City': 'تهران', 'Neighborhood': '، میرداماد'}",از شنبه تا چهارشنبه از ساعت 8 تا 16:48. پنج شنبه ها روز کاری شرکت محسوب نمیشود و  در صورت نیاز به حضور در شرکت، اضافه کار محسوب خواهد شد.,تمام وقت,"['Java - متوسط', 'Python - متوسط', 'JQuery - متوسط', 'Linux - متوسط', 'Oracle Form & Report - متوسط']",['شرح شغل:'],"[('سن', '22 - 45 سال'), ('جنسیت', 'تفاوتی ندارد'), ('خدمت سربازی', 'اتمام خدمت سربازی و یا معافیت از آن الزامی است'), ('تحصیلات', 'کارشناسی|کامپیوتر / فناوری اطلاعاتکارشناسی|مهندسی برقکارشناسی|مهندسی صنایع'), ('زبان', 'انگلیسی|متوسط ۵۰٪'), ('نرم افزارها', 'JQuery|متوسطJava|متوسطPython|متوسطOracle Form & Report|متوسطLinux|متوسط')]"
Content Insight Senior Specialist,Digikala,"{'City': 'Tehran', 'Neighborhood': ', Chitgar'}",Saturday to Wendsday,Full Time,"['3 years experience in similar position', 'Bachelor Computer and IT or Business/Management/Commerce or Industrial Engineering or Math / Statistics']","['CIO stands for Content Insights & Innovation. The CIO’s vision is to lighten up content creation path and optimize processes using data and evidences. A Content Insight Senior Specialist is a passionate and highly sensitive to details who cleans and analyzes data in order to hunt products which are in need of enrichment and evaluate performance changelogs.', 'Responsibilities:', '· \xa0 \xa0 \xa0 Mining and wrangling data from various sources', '· \xa0 \xa0 \xa0 Performing data analysis and visualization (using most used programming languages like Python or R)', '· \xa0 \xa0 \xa0 Creating databases and interactive dashboards (Using Power BI or Tableau)', '· \xa0 \xa0 \xa0 Defining and monitoring precise metrics which indicate content performance', '· \xa0 \xa0 \xa0 Trying to stay updated on the most used tools and libraries', '· \xa0 \xa0 \xa0 Clustering products based on their characteristics', '· \xa0 \xa0 \xa0 Precisely target products in need of enrichment and drafting briefs', '· \xa0 \xa0 \xa0 Setting proper KPIs', '· \xa0 \xa0 \xa0 Collaborating with other CIO teams', '· \xa0 \xa0 \xa0 Targeting and analyzing leaf-categories to create a holistic report', 'Requirements:', '· \xa0 \xa0 \xa0 Advanced knowledge on Microsoft Excel', '· \xa0 \xa0 \xa0 Advanced knowledge on programming languages used in industry (like Python or R)', '· \xa0 \xa0 \xa0 Advanced knowledge on essential statistic concepts', '· \xa0 \xa0 \xa0 Data Analysis and Wrangling skills', '· \xa0 \xa0 \xa0 Power BI or Tableau', '· \xa0 \xa0 \xa0 Deep understanding of how an e-commerce works', '· \xa0 \xa0 \xa0 Proper knowledge on Business Administration', '· \xa0 \xa0 \xa0 Basic knowledge of content strategy', '· \xa0 \xa0 \xa0 Data story-telling would be a plus']","[('Gender', 'Men / Women'), ('Education', 'Bachelor|Computer and ITBachelor|Business/Management/CommerceBachelor|Industrial EngineeringBachelor|Math / Statistics'), ('Language', 'English|Upper Intermediate 70%'), ('Software', 'R|IntermediateTableau|IntermediatePowerBI|IntermediatePython|IntermediateMicrosoft Excel|Intermediate')]"
کارآموز مکاترونیک و هوش مصنوعی,باشگاه رباتیک باغ کتاب تهران (مو سی تو),"{'City': 'تهران', 'Neighborhood': '، ونک'}",توافقی,پاره وقت,[],"['باشگاه رباتیک باغ کتاب تهران رسالتش آموزش رباتیک، مکاترونیک و هوش مصنوعی در بالاترین سطح کیفی ممکن، پیاده سازی پروژه های تحقیقاتی و صنعتی، برگزاری رویداد های خاص و مسابقات حوزه ی رباتیک و.. در سطح جهانی می باشد؛ اکنون در راستای اهداف خویش از دانشجویان ، فارغ التحصیلان و افراد مستعد، مسئولیت پذیر و مشتاق یادگیری مداوم؛ برای همکاری دعوت به عمل می آورد.', 'انتظار ما از شما:', 'کسب مهارت های تخصصی، دانش عمیق و تجربه عملی در چهارراه تلاقی ایده هاست و همچنین می بایست در چرخه ی انتقال این دانش و تجربه به هم نوعان قرار گیرید .']","[('سن', 'تا 30 سال'), ('جنسیت', 'تفاوتی ندارد')]"
کارشناس هوش تجاری (تحلیلگر داده),داده کاوان هوشمند توسن,"{'City': 'تهران', 'Neighborhood': '، جردن'}",چرخشی,تمام وقت,['PowerBI - پیشرفته'],"['· تحلیل کسب وکار و شناخت نیازمندی ها', '· تحلیل کاربردی و مدل سازی داده محور مسائل', '· طراحی زیرساخت های اطلاعاتی مبتنی بر DW/DB', '· پیاده سازی فرآیندهای تبدیل و انتقال اطلاعات', '· پیاده سازی روش های پردازش اطلاعات', 'نیازمندی ها:', '. شناخت پایگاه داده (DB) و انبار داده (DW)', '. توانایی کوئری نویسی و پیاده سازی ETL', '. آشنایی با رویکردهای طراحی و توسعه داشبوردهای BI', '. شناخت رویکردهای داده کاوی و یادگیری ماشین', '. توانایی انجام کار گروهی', '. توانایی تحلیل و مهارت حل مسئله']","[('جنسیت', 'تفاوتی ندارد'), ('خدمت سربازی', 'اتمام خدمت سربازی و یا معافیت از آن الزامی است'), ('نرم افزارها', 'PowerBI|پیشرفته')]"
کارشناس مدیریت داده,گروه صنعتی گلرنگ,"{'City': 'تهران', 'Neighborhood': '، ساعی - توانیر'}",شنبه تا چهارشنبه ساعت 7:45 تا 16:30 پنج شنبه 7:45 تا 13:30,تمام وقت,"['Microsoft Word - متوسط', 'Microsoft Excel - متوسط', 'Sql Server - پیشرفته', 'Visual Paradigm - مقدماتی']","['شایستگی ها (دانش و مهارت):', 'آشنایی با آمار', 'آشنایی با فرآیندهای بازرگانی،زنجیره تامین و فروش', 'آشنایی با مفاهیم مدیریت داده', 'توانایی پردازش و تحلیل داده با ابزارهای مرتبط', 'تسلط به Office \xa0و زبان SQL', 'آشنایی با visual studio, paradigm', 'شرح وظایف و مسئولیت ها:', 'بررسی و صحت سنجی داده ها', 'گزارش گیری، شناسایی خطاها و مغایرت ها و ارائه راه حل برای کاهش خطا', 'یکسان سازی ( مسترینگ) موجودیت های داده اعم از کالا،خدمات مشتری و ....', 'ارزیابی کیفیت داده ها و تهیه گزارشات مرتبط']","[('سن', '23 - 35 سال'), ('جنسیت', 'تفاوتی ندارد'), ('خدمت سربازی', 'اتمام خدمت سربازی و یا معافیت از آن الزامی است'), ('تحصیلات', 'کارشناسی|مهندسی صنایعکارشناسی|کامپیوتر / فناوری اطلاعاتکارشناسی|ریاضی و آمارکارشناسی|مالی و حسابداریکارشناسی|مدیریت / بازرگانی / کسب و کار'), ('زبان', 'انگلیسی|متوسط ۵۰٪'), ('نرم افزارها', 'Sql Server|پیشرفتهMicrosoft Word|متوسطMicrosoft Excel|متوسطVisual Paradigm|مقدماتی')]"
مدیر هوش تجاری - آقا,سازمانی فعال در حوزه کالاهای مصرفی و تند گردش,"{'City': 'تهران', 'Neighborhood': '، فردوسی'}",شنبه تا چهارشنبه 8 الی17,تمام وقت,[],"['شرکت پخش در زمینه پخش و توزیع مواد غذایی جهت تکمیل کادر نیروی انسانی نیاز به مدیر هوش تجاری با مشخصات زیر می باشد لطفا متقاضیان رزومه خود را ارسال فرمایند .', 'انجام و کنترل کلیه امور لازم در جهت ایجاد تمرکز در پیشبرد پروژه های محوله', 'توسعه محصولات و تیم سازی با هدف پایدار سازی روند دریافت و انجام پروژه های مرتبط با بازدهی مطلوب', 'تسلط به مدیریت Agile \xa0و روش های برنامه ریزی و کنترل پروژه', 'توانمندی رهبری فعالیت های نظیر \xa0 Analysis visualization, Data warehousing , ETL', 'تسلط به فرآیندهای داده کاوی و حداقل یکی از ابزارهای مربوط به آن', 'تسلط به مستندسازی و ارزیابی گزارشات ، تهیه و تدوین گزارش های مدیریتی', 'آشنا با تحلیل و طراحی سیستم و فرآیندهای تولید نرم افزار', 'آشنایی به مفاهیم و تحلیل های آماری', 'آشنا با مباحث برنامه ریزی و بودجه بندی برای پروژه های تکنولوژیک', 'آشنا با مباحث توسعه چارت سازمانی و Manpower Hisrtogarm', 'آشنا به راهکارهای داده محور برای مسائل تکنولوژیک', 'آشنا به مفاهیم Data Engineering']","[('سن', '30 - 45 سال'), ('جنسیت', 'فقط آقا'), ('خدمت سربازی', 'اتمام خدمت سربازی و یا معافیت از آن الزامی است'), ('تحصیلات', 'کارشناسی|مدیریت / بازرگانی / کسب و کارکارشناسی|مهندسی صنایع'), ('زبان', 'انگلیسی|متوسط ۵۰٪'), ('نرم افزارها', 'Microsoft Word|پیشرفتهMicrosoft Excel|پیشرفتهMicrosoft Outlook|پیشرفتهSAP2000|پیشرفته')]"
BI Expert,Daria hamrah paytakht,"{'City': 'Tehran', 'Neighborhood': ', Ghaem Magham'}","Sat to Wed From 9 to 5, Thu From 9 to 1",Full Time,['2 years experience in similar position'],"['· \xa0 \xa0 \xa0 \xa0Python Programming with clean coding', '· \xa0 \xa0 \xa0 \xa0Object Oriented Programming (OOP)', '· \xa0 \xa0 \xa0 \xa0Pandas, Numpy', '· \xa0 \xa0 \xa0 \xa0Visualization with Matplotlib, Seaborn', '· \xa0 \xa0 \xa0 \xa0Excel, Google sheets', '· \xa0 \xa0 \xa0 \xa0SQL (PostgreSQL)', '· \xa0 \xa0 \xa0 \xa0NoSQL (MongoDB)', '· \xa0 \xa0 \xa0 \xa0Familiar with Jira', 'others:', '· \xa0 \xa0 \xa0 \xa0Team working', '· \xa0 \xa0 \xa0 \xa0Strong Communication Skill', '· \xa0 \xa0 \xa0 \xa0learning is high priority for you', '· \xa0 \xa0 \xa0 \xa0Multi task', '· \xa0 \xa0 \xa0 \xa0Familiar with basic conflict management', '· \xa0 \xa0 \xa0 \xa0Familiar with agile concept', 'Has positive point:', '· \xa0 \xa0 \xa0 \xa0Familiar with design patterns like: Abstract Factory, Singleton', '· \xa0 \xa0 \xa0 \xa0Pyspark', '· \xa0 \xa0 \xa0 \xa0Google APIs (Sheets, Analytics, GCP)', '· \xa0 \xa0 \xa0 \xa0Machine Learning with sklearn, tensorflow2']","[('Gender', 'Men / Women'), ('Software', 'Python|IntermediateMicrosoft Excel|IntermediateSql Server|IntermediateMongoDB|Intermediate')]"
سرپرست تحلیل اطلاعات,سرمایه گذاری دارویی گلرنگ,"{'City': 'تهران', 'Neighborhood': '، جردن'}",شنبه الی چهارشنبه از ساعت 7:45 الی 17:00,تمام وقت,"['Sql Server - متوسط', 'MySql - متوسط', 'Qlikview - متوسط', 'PowerBI - متوسط', 'SSIS - متوسط']","['تهیه لیست KPI ها و شاخص های عملیاتی و مدیریتی منابع انسانی', 'ایجاد ساز و کار دریافت مکانیزه داده ها از سیستم های اطلاعاتی مورد استفاده', 'جمع آوری، تحلیل و یکپارچه سازی دیتای مورد نیاز و نمایش بصورت داشبوردهای منابع انسانی', 'برقراری ارتباط موثر با شرکت های هلدینگ برای دریافت و تحلیل داده ها', 'نگهداری و پشتیبانی از پلتفرم تجزیه و تحلیل دیتا', 'توانمندی های مورد نیاز:', 'توانایی کار با دیتابیس و گزارش گیری از آن مانند، MySQL،SQL Server، elasticsearch SQL Server Reporting Services (SSRS)، SQL Server Integration Services (SSIS)', 'آشنایی با سیستم های مدیریت دیتابیس،ETL ، Data Warehouse', 'آشنایی با \xa0QlikView، Microsoft power BI', 'توانایی تحلیل داده و تبدیل داده به اطلاعات ویژوال و گزارش گیری']","[('جنسیت', 'تفاوتی ندارد'), ('خدمت سربازی', 'اتمام خدمت سربازی و یا معافیت از آن الزامی است'), ('تحصیلات', 'کارشناسی ارشد|مهندسی صنایعکارشناسی ارشد|کامپیوتر / فناوری اطلاعات'), ('نرم افزارها', 'MySql|متوسطSql Server|متوسطSSIS|متوسطPowerBI|متوسطQlikview|متوسط')]"
برنامه نویس هوش مصنوعی,ارزش کاوان توسعه امین (اکتا),"{'City': 'تهران', 'Neighborhood': '، اقدسیه'}",شنبه تا چهارشنبه شناور,تمام وقت یا پاره وقت,['Python - متوسط'],"['مهارت های فنی مورد نیاز:', 'مهارت های شخصیتی:']","[('جنسیت', 'تفاوتی ندارد'), ('زبان', 'انگلیسی|بالاتر از متوسط ۷۰٪'), ('نرم افزارها', 'Python|متوسط')]"
کارشناس هوش مصنوعی,دید الکترونیک مبین,"{'City': 'تهران', 'Neighborhood': '، نواب'}",شنبه تا چهارشنبه 8 الی 17:30,تمام وقت,"['C++ - متوسط', 'Python - متوسط', 'GIT - متوسط']","['به یک همکار پر انگیزه در حوزه هوش مصنوعی در محیط کاملا جوان نیازمندیم .', 'از موارد زیر حداقل باید در 5 مورد ""حتما علاقه"" و ""ترجیحا تجربه، اگه نشد تسلط، اگه نشد آشنایی"" داشته باشید:', '- برنامه نویسی python', '-برنامه نویسی C++', '- بینایی ماشین و opencv یا کتابخانه های مشابه', '- آشنایی با کتابخانه های pytorch یا tensorflow جهت راه اندازی شبکه های عصبی train شده', '- تجربه پروژه پیاده سازی هوش مصنوعی روی ربات ها (ترجیحا ربات های پرنده)', '- تسلط به زبان انگلیسی و توانایی و علاقه به research', '- تجربه انجام پروژه در زمینه های هدایت، ناوبری و کنترل ربات های پرنده', '- تسلط، آشنایی یا علاقه به شبیه سازهای نرافزاری رباتیک از قبیل airsim ،gazebo ،flightmare ،webots یا ...', '- تجربه در توسعه نرم افزارهای large scale مبتنی بر C++ یا python', '-تسلط به git، آشنایی با github و تجربه و توانایی در تحقیق، راه اندازی و تحلیل نرم افزارهای open source منتشرشده', '- آشنایی یا تسلط به موتور بازی سازی unreal engine', '-تسلط به تئوری های مربوط به دینامیک و کنترل اجسام پرنده', '- تجربه در زمینه ترکیب سنسورها و پیاده سازی تخمینگرهایی از قبیل فیلتر کالمن']","[('سن', 'تا 29 سال'), ('جنسیت', 'تفاوتی ندارد'), ('تحصیلات', 'کارشناسی|کامپیوتر / فناوری اطلاعاتکارشناسی|مهندسی هوافضاکارشناسی|مهندسی برقکارشناسی|مهندسی مکانیککارشناسی|مهندسی پزشکی'), ('زبان', 'انگلیسی|متوسط ۵۰٪'), ('نرم افزارها', 'Python|متوسطC++|متوسطGIT|متوسط')]"
کارشناس مدیریت پایگاه های داده,شرکت ماورای ابعاد رایکا,"{'City': 'تهران', 'Neighborhood': '، پاسداران'}",شنبه تا چهارشنبه 9 تا 17 پنج شنبه 9 تا 14,تمام وقت,"['MySql - متوسط', 'PostgreSql - متوسط', 'Linux - متوسط']","['دانش های مورد نیاز:', 'SQL, Database Management Systems (e.g., MySQL, PostgreSQL)', 'کار با هوش مصنوعی با کمک ابزارهای تولید:', 'مترجم GPT CODE برای برنامه نویسی پایگاه داده', 'مسلط به زبان SQL و اسکریپت نویسی با مهارت بالا و پرفورمنس بالا', 'تسلط بر ابزارهای مانیتورینگ استاندارد لینوکس و SQL SERVER', 'آشنایی با ابزارهای مانیتورینگ THIRDPARTY مربوط به SQL SERVER', 'تسلط بر عملیات های BACKUP ، RESTORE و ریکاوری مدل ها ، PERFORMANCE TUNING و استفاده از ابزارهای آنها ، HIGH AVAILABILITY', 'تجربه کار با دیتابیس های حجیم', 'تسلط بر مباحث امنیتی و دسترسی ها در SQL SERVER', 'داشتن حداقل 2سال سابقه کار عملیاتی در DBA', 'روز و ساعت کاری :', 'شنبه تا چهارشنبه 8-17', 'پنجشنبه ها 8-12', 'امکان دورکاری (به طور دائم دردسترس بودن پرسنل) و ساعت کاری منعطف', 'محل کار :', 'تهران ، خیابان پاسداران', 'مزایا و تسهیلات :', 'وام', 'بروزترین و کاملترین تجهیزات در اختیار پرسنل', 'سفرهای خارجی برای یک سری از تخصص های خاص ویا آموزش (هزینه کاملا با سازمان)', 'توانایی استقرار نیروهایی از شهرستان در تهران', 'امکانات رفاهی ، پاداش و تشویقی', 'پک پذیرایی مهمان', 'برگزاری دوره های آموزشی', 'بسته ها و هدایای مناسبتی ، دعوت به ظیافت', 'زمان استراحت و بازی', 'ارتقا شغلی تنها با اثبات توانمندی و توانایی ها ، عملکردی کمک کننده به فعالیت سازمان با در نظر گرفتن استعداد ، خلاقیت ، ایده پردازی و ایده آل گرایی', 'محیط کار حرفه ای و پویا در کنار جمعی دوستانه', 'امکان جذب معلولین در صورتی که نوع آن جسمی-حرکتی باشد و توانایی های ذهنی فرد ، فراتر از مشکل جسمی او باشد (بتواند کار را انجام دهد ویا به صورت دورکاری کد بزند)', 'پرداخت به موقع حقوق', 'بیمه (از روز اول) و بیمه تکمیلی', 'پرداخت اضافه کاری', 'یک ماه آزمایشی و آموزشی با حقوق (در صورت صلاح دید مدیریت)', 'نظام وظیفه : امریه', 'مدرک تحصیلی : برای جوانان حداقل دیپلم', 'مدارک و گواهینامه های دوره های آموزشی امتیاز محسوب میگردد', 'ما در خانواده ی سخت کوش و خستگی ناپذیر شرکت ماورای ابعاد رایکا ، برای تحقق رویاهایمان میجنگیم. در کنار هم میسازیم و از تماشای آنچه \xa0روزی تصور کرده بودیم و حالا به آن تجسم بخشیده ایم لذت میبریم.']","[('سن', '20 - 30 سال'), ('جنسیت', 'ترجیحاً آقا'), ('زبان', 'انگلیسی|بالاتر از متوسط ۷۰٪'), ('نرم افزارها', 'MySql|متوسطPostgreSql|متوسطLinux|متوسط')]"
